{
  "$schema": "https://json-schema.org/draft/2020-12/schema",
  "title": "Daylight v14C+ Scorecard",
  "type": "object",
  "additionalProperties": false,
  "required": [
    "scorecard_version",
    "candidate",
    "status",
    "generated",
    "manual_override",
    "weight_vector_ref",
    "q_vector",
    "term_contributions_M",
    "unified_score_rational",
    "unified_score_decimal",
    "final_score_M",
    "input_ledger_head",
    "output_ledger_head",
    "corpus_snapshot_digest",
    "reproducibility_receipt_digest",
    "scorecard_digest",
    "manual_edit_allowed"
  ],
  "properties": {
    "scorecard_version": {"type": "string", "const": "daylight-v14c-plus-scorecard-v0.2"},
    "candidate": {"type": "string", "const": "DAYLIGHT v14C+ ASCENDANT CANDIDATE"},
    "status": {"type": "string", "const": "candidate_score_pending_generated_execution"},
    "generated": {"type": "boolean", "const": true},
    "manual_override": {"type": "boolean", "const": false},
    "weight_vector_ref": {"type": "string", "const": "daylight-v13-weight-vector"},
    "q_vector": {"type": "array"},
    "term_contributions_M": {"type": "array"},
    "unified_score_rational": {"type": "string"},
    "unified_score_decimal": {"type": "string"},
    "final_score_M": {"type": "integer"},
    "input_ledger_head": {"type": "string", "minLength": 64},
    "output_ledger_head": {"type": "string", "minLength": 64},
    "corpus_snapshot_digest": {"type": "string", "minLength": 64},
    "reproducibility_receipt_digest": {"type": "string", "minLength": 64},
    "scorecard_digest": {"type": "string", "minLength": 64},
    "manual_edit_allowed": {"type": "boolean", "const": false}
  }
}
